### DISCUSSION TITLE
RU Invalid TLS handshake

### DISCUSSION THREAD

**Discussion by fue-medatixx** [Digitaler-Impfnachweis/certification-apis#58] [Q&A]
While sending the challenge request to RU there is an error in the TLS handshake and the connection is cancelled.
CURL verbose:
*   Trying 10.30.17.10...
* TCP_NODELAY set
* Connected to id.ru.impfnachweis.info (10.30.17.10) port 443 (#0)
* schannel: SSL/TLS connection with id.ru.impfnachweis.info port 443 (step 1/3)
* schannel: checking server certificate revocation
* schannel: sending initial handshake data: sending 188 bytes...
* schannel: sent initial handshake data: sent 188 bytes
* schannel: SSL/TLS connection with id.ru.impfnachweis.info port 443 (step 2/3)
* schannel: failed to receive handshake, need more data
* schannel: SSL/TLS connection with id.ru.impfnachweis.info port 443 (step 2/3)
* schannel: failed to receive handshake, SSL/TLS connection failed
* Closing connection 0
* schannel: shutting down SSL/TLS connection with id.ru.impfnachweis.info port 443
* Send failure: Connection was reset
* schannel: failed to send close msg: Failed sending data to the peer (bytes written: -1)
* schannel: clear security context handle
curl: (35) schannel: failed to receive handshake, SSL/TLS connection failed

WhireShark Log:
1	0.000000	10.150.114.122	10.30.17.10	TCP	66	63379 → 443 [SYN, ECN, CWR] Seq=0 Win=64240 Len=0 MSS=1460 WS=256 SACK_PERM=1
2	0.082555	10.30.17.10	10.150.114.122	TCP	66	443 → 63379 [SYN, ACK] Seq=0 Ack=1 Win=29200 Len=0 MSS=1276 SACK_PERM=1 WS=128
3	0.082684	10.150.114.122	10.30.17.10	TCP	54	63379 → 443 [ACK] Seq=1 Ack=1 Win=262656 Len=0
4	0.109925	10.150.114.122	10.30.17.10	TLSv1.2	242	Client Hello
5	0.214206	10.30.17.10	10.150.114.122	TCP	60	443 → 63379 [ACK] Seq=1 Ack=189 Win=30336 Len=0
6	0.245722	10.30.17.10	10.150.114.122	SSL	300	[TCP Previous segment not captured] , Continuation Data
Frame 6: 300 bytes on wire (2400 bits), 300 bytes captured (2400 bits) on interface \Device\NPF_{12424E88-004C-4D55-89E1-03E33EB5142F}, id 0
Ethernet II, Src: secunetS_f2:51:da (00:1c:19:f2:51:da), Dst: VMware_9d:3f:3f (00:50:56:9d:3f:3f)
Internet Protocol Version 4, Src: 10.30.17.10, Dst: 10.150.114.122
Transmission Control Protocol, Src Port: 443, Dst Port: 63379, Seq: 5121, Ack: 189, Len: 246
    Source Port: 443
    Destination Port: 63379
    [Stream index: 0]
    [TCP Segment Len: 246]
    Sequence Number: 5121    (relative sequence number)
    Sequence Number (raw): 2168283670
    [Next Sequence Number: 5367    (relative sequence number)]
    Acknowledgment Number: 189    (relative ack number)
    Acknowledgment number (raw): 4080500988
    0101 .... = Header Length: 20 bytes (5)
    Flags: 0x018 (PSH, ACK)
    Window: 237
    [Calculated window size: 30336]
    [Window size scaling factor: 128]
    Checksum: 0x803c [unverified]
    [Checksum Status: Unverified]
    Urgent Pointer: 0
    [SEQ/ACK analysis]
        [iRTT: 0.082684000 seconds]
        [TCP Analysis Flags]
            **[Expert Info (Warning/Sequence): Previous segment(s) not captured (common at capture start)]
                [Previous segment(s) not captured (common at capture start)]
                [Severity level: Warning]
                [Group: Sequence]**
    [Timestamps]
    TCP payload (246 bytes)
Transport Layer Security
